id;name_of_bank;account_number;type_of_account;ifsc_code;branch_address;corporate_id
1;ICICI;web-readiness interface;Auto Loan Account Personal Loan Account;systems zero tolerance Iowa;sticky benchmark Point;program Soft interface
2;ANDHRABANK;Shirt SDD;communities Refined;Pike Borders;payment Rustic;envisioneer Coordinator
3;HDFC;matrices;Savings Account redefine Multi-channelled;Team-oriented;initiatives;Jordan
4;ANDHRABANK;Persevering Personal Loan Account;De-engineered strategic integrate;array payment;optical transmitter;Utah COM
5;SBI;zero defect;Granite;Program;deposit;Estate
6;HDFC;Shirt Architect Developer;Automotive;invoice;Minnesota Open-architected Lebanon;Tugrik Wooden
7;ANDHRABANK;capacitor;feed;Officer;feed;communities
8;ICICI;Identity Lek Bedfordshire;transmitting COM;Music Data East Caribbean Dollar;Savings Account Branding navigating;payment Incredible deposit
9;HDFC;USB primary Iowa;Refined withdrawal copy;Kuwaiti Dinar solid state program;help-desk SAS embrace;Nigeria
10;ANDHRABANK;seamless mesh;disintermediate Jordan Savings Account;deploy Advanced;New Mexico;Pakistan Rupee
